{
  "items": [
    {
      "id": "task_buy-milk",
      "listId": "list_home",
      "title": "Buy milk",
      "notes": "2% milk",
      "status": "open",
      "completedAt": null,
      "priority": "medium",
      "dueAt": "2026-10-11T16:00:00Z",
      "startAt": null,
      "timeZone": "Europe/Berlin",
      "durationSeconds": null,
      "url": null,
      "locationTrigger": null,
      "recurrence": null,
      "alerts": [
        { "id": "due-alert", "kind": "relative", "offsetSeconds": -3600 }
      ],
      "tags": ["groceries"],
      "position": "a0",
      "providerRefs": [
        {
          "provider": "apple-reminders",
          "accountId": "icloud:user-opaque",
          "resourceType": "task",
          "resourceId": "x-apple-reminders-task-opaque",
          "parentResourceId": "x-apple-reminders-list-opaque",
          "url": "x-apple-reminders://task/x-apple-reminders-task-opaque",
          "etag": "provider-etag-3",
          "observedAt": "2026-10-10T10:00:00Z"
        }
      ],
      "createdAt": "2026-10-09T08:00:00Z",
      "updatedAt": "2026-10-10T10:00:00Z",
      "revision": 3,
      "etag": "\"task_buy-milk-3\""
    }
  ],
  "nextCursor": null,
  "hasMore": false,
  "serverTime": "2026-10-10T10:00:02Z"
}
